   Input file: raw
  Output file: raw.out
Database file: ../database/phreeqc.dat

------------------
Reading data base.
------------------

	SOLUTION_MASTER_SPECIES
	SOLUTION_SPECIES
	PHASES
	EXCHANGE_MASTER_SPECIES
	EXCHANGE_SPECIES
	SURFACE_MASTER_SPECIES
	SURFACE_SPECIES
	RATES
	END
------------------------------------
Reading input data for simulation 1.
------------------------------------

	database ../database/phreeqc.dat
	SURFACE_MASTER_SPECIES
	        Surf    SurfOH
	SURFACE_SPECIES
	        SurfOH = SurfOH
	                log_k   0.0
	        SurfOH  + H+ = SurfOH2+
	                log_k   7.29
	        SurfOH = SurfO- + H+
	                log_k   -8.93
	        SurfOH + AsO4-3 + 3H+ = SurfH2AsO4 + H2O
	                log_k   29.31
	        SurfOH + AsO4-3 + 2H+ = SurfHAsO4- + H2O
	                log_k   23.51
	        SurfOH + AsO4-3 = SurfOHAsO4-3
	                log_k   10.58
	SOLUTION_MASTER_SPECIES
	        As       H3AsO4        -1.0     74.9216         74.9216
	SOLUTION_SPECIES
		H3AsO4 = H2AsO4- + H+
		log_k	-2.3
		delta_h	-7.066	kJ
		H3AsO4 = HAsO4-2 + 2H+
		log_k	-9.46
		delta_h	-3.846	kJ
		H3AsO4 = AsO4-3 + 3H+
		log_k	-21.11
		delta_h	14.354	kJ
	        H3AsO4 = H2AsO4- + H+ 
	        log_k           -2.243
	        delta_h -1.69 kcal
	        H3AsO4 = HAsO4-2 + 2H+ 
	        log_k           -9.001
	        delta_h -0.92 kcal
	        H3AsO4 = AsO4-3 + 3H+
	        log_k           -20.597
	        delta_h 3.43 kcal
	        H3AsO4 = H3AsO4
	        log_k           0.0
	        H3AsO4 = AsO4-3 + 3H+
	        log_k   -20.7
	        H+ + AsO4-3 = HAsO4-2
	        log_k   11.50
	        2H+ + AsO4-3 = H2AsO4-
	        log_k           18.46
	END
------------------
End of simulation.
------------------

------------------------------------
Reading input data for simulation 2.
------------------------------------

	SOLUTION_RAW       20
	  -temp              25
	  -pH                7
	  -pe                4
	  -mu                1e-07
	  -ah2o              1
	  -total_h           111.01974134192
	  -total_o           55.535325076996
	  -cb                0.0012883279473439
	  -mass_water        1
	  -total_alkalinity  0
	  -totals
	    As   4.1908616387069e-07
	    C   0.0096003939798442
	    Ca   9.3009440332783e-05
	    Cl   0.0032689522220291
	    Mg   6.6514137243683e-05
	    Na   0.01444565173261
	    S   0.00023718575024482
	  -activities
	    As   -8.3776966771614
	    C(-4)   -4.0177109440686
	    C(4)   -4.0177109440686
	    Ca   -6.0314729689045
	    Cl   -4.4855914268839
	    Mg   -6.1770860377888
	    Na   -3.8402628596702
	    S(-2)   -5.6249114062687
	    S(6)   -5.6249114062687
	  -gammas
	  -Isotopes
	EXCHANGE_RAW       20 Exchanger defined in simulation 1.
	  -pitzer_exchange_gammas 1
	  -component
	    -formula               X
	    -moles                 0
	    -la                    0.60688497237009
	    -charge_balance        0
	    -phase_proportion              0
	    -formula_z                     0
	    -totals
	      Ca   0.067100780469236
	      Mg   0.029709189613889
	      Na   0.30638006319249
	      X   0.50000000335874
	    -formula_totals
	      X   0.5
	EQUILIBRIUM_PHASES_RAW       20 Pp_Assemblage defined in simulation 1.
	  -eltList       
	    C   3
	    Ca   2
	    Mg   1
	    O   9
	  -component
	    -name                  Calcite
	    -si                    0
	    -moles                 0.11781770315801
	    -delta                 0
	    -initial_moles         0.1180709871316
	    -force_equality        0
	    -dissolve_only         0
	  -component
	    -name                  Dolomite
	    -si                    0
	    -moles                 1.568403984096
	    -delta                 0
	    -initial_moles         1.5687877423086
	    -force_equality        0
	    -dissolve_only         0
	SURFACE_RAW       20 Surface defined in simulation 1.
	  -type 2
	  -dl_type 0
	  -sites_units 0
	  -only_counter_ions 0
	  -thickness 1e-08
	  -debye_lengths 0
	  -DDL_viscosity 1
	  -DDL_limit 0.8
	  -transport 0
	  -component
	    -formula               SurfOH
	    -formula_z             0
	    -moles                 0
	    -la                    -0.20250616397962
	    -charge_number         0
	    -charge_balance        0.084703340238721
	    -phase_proportion      0
	    -Dw                    0
	    -formula_totals
	      H   0.14
	      O   0.14
	      Surf   0.14
	    -totals
	      As   0.0080729678646393
	      H   0.17518734394924
	      O   0.17225449222186
	      Surf   0.14000000006222
	  -charge_component 
	    -name                  Surf
	    -specific_area         600
	    -grams                 30
	    -charge_balance        0.011043198890933
	    -mass_water            0
	    -la_psi                0.46673410986017
	    -la_psi1               0
	    -la_psi2               0
	    -capacitance0          1
	    -capacitance1          5
	    -diffuse_layer_totals
	USE solution 20
	USE exchange 20
	USE equilibrium_phases 20
	USE surface 20
	END
-----------------------------------------
Beginning of batch-reaction calculations.
-----------------------------------------

Reaction step 1.

Using solution 20.	
Using exchange 20.	Exchanger defined in simulation 2.
Using surface 20.	Surface defined in simulation 2.
Using pure phase assemblage 20.	Pp_Assemblage defined in simulation 2.

-------------------------------Phase assemblage--------------------------------

                                                      Moles in assemblage
Phase                SI   log IAP  log KT      Initial       Final       Delta

Calcite            0.00     -8.48   -8.48    1.178e-01   1.157e-01  -2.079e-03
Dolomite           0.00    -17.09  -17.09    1.568e+00   1.564e+00  -3.973e-03

------------------------------Surface composition------------------------------

Surf          
	  2.882e-04  Surface charge, eq
	  1.545e-03  sigma, C/m**2
	  3.967e-03  psi, V
	 -1.544e-01  -F*psi/RT
	  8.569e-01  exp(-F*psi/RT)
	  6.000e+02  specific area, m**2/g
	  1.800e+04  m**2 for   3.000e+01 g


Surf          
	  1.400e-01  moles
	                                   Mole                     Log
	Species               Moles    Fraction    Molality    Molality

	SurfOH            9.432e-02       0.674   9.432e-02      -1.025
	SurfOH2+          3.104e-02       0.222   3.104e-02      -1.508
	SurfOHAsO4-3      8.054e-03       0.058   8.054e-03      -2.094
	SurfO-            6.567e-03       0.047   6.567e-03      -2.183
	SurfHAsO4-        1.954e-05       0.000   1.954e-05      -4.709
	SurfH2AsO4        2.080e-07       0.000   2.080e-07      -6.682

-----------------------------Exchange composition------------------------------

X                5.000e-01 mol

	                               Equiv-    Equivalent      Log 
	Species             Moles      alents      Fraction     Gamma

	NaX               2.867e-01   2.867e-01   5.733e-01    -0.069
	CaX2              7.306e-02   1.461e-01   2.922e-01    -0.266
	MgX2              3.361e-02   6.723e-02   1.345e-01    -0.260

-----------------------------Solution composition------------------------------

	Elements           Molality       Moles

	As                1.858e-08   1.858e-08
	C                 1.963e-02   1.963e-02
	Ca                1.898e-04   1.898e-04
	Cl                3.269e-03   3.269e-03
	Mg                1.360e-04   1.360e-04
	Na                3.416e-02   3.416e-02
	S                 2.372e-04   2.372e-04

----------------------------Description of solution----------------------------

                                       pH  =   7.706      Charge balance
                                       pe  =  12.900      Adjusted to redox equilibrium
       Specific Conductance (uS/cm, 25 oC) = 2574
                          Density (g/cm3)  =   0.99865
                        Activity of water  =   0.999
                           Ionic strength  =   2.900e-02
                       Mass of water (kg)  =   1.000e+00
                 Total alkalinity (eq/kg)  =   1.903e-02
                       Total CO2 (mol/kg)  =   1.963e-02
                      Temperature (deg C)  =  25.000
                  Electrical balance (eq)  =   1.204e-02
 Percent error, 100*(Cat-|An|)/(Cat+|An|)  =  21.18
                               Iterations  =  17
                                  Total H  = 1.110305e+02
                                  Total O  = 5.556538e+01

----------------------------Distribution of species----------------------------

                                                   Log       Log         Log 
   Species                 Molality    Activity  Molality  Activity     Gamma

   OH-                    6.002e-07   5.079e-07    -6.222    -6.294    -0.073
   H+                     2.249e-08   1.969e-08    -7.648    -7.706    -0.058
   H2O                    5.551e+01   9.990e-01     1.744    -0.000     0.000
As               1.858e-08
   HAsO4-2                1.672e-08   8.800e-09    -7.777    -8.056    -0.279
   H2AsO4-                1.856e-09   1.580e-09    -8.732    -8.801    -0.070
   AsO4-3                 5.988e-12   1.413e-12   -11.223   -11.850    -0.627
   H3AsO4                 5.373e-15   5.409e-15   -14.270   -14.267     0.003
C(-4)            0.000e+00
   CH4                    0.000e+00   0.000e+00  -143.611  -143.608     0.003
C(4)             1.963e-02
   HCO3-                  1.853e-02   1.590e-02    -1.732    -1.799    -0.067
   CO2                    6.998e-04   7.045e-04    -3.155    -3.152     0.003
   NaHCO3                 2.567e-04   2.584e-04    -3.591    -3.588     0.003
   CO3-2                  6.992e-05   3.786e-05    -4.155    -4.422    -0.266
   NaCO3-                 2.392e-05   2.038e-05    -4.621    -4.691    -0.070
   CaHCO3+                2.069e-05   1.775e-05    -4.684    -4.751    -0.067
   MgHCO3+                1.415e-05   1.206e-05    -4.849    -4.919    -0.070
   CaCO3                  5.528e-06   5.565e-06    -5.257    -5.255     0.003
   MgCO3                  2.326e-06   2.341e-06    -5.633    -5.631     0.003
Ca               1.898e-04
   Ca+2                   1.616e-04   8.750e-05    -3.792    -4.058    -0.266
   CaHCO3+                2.069e-05   1.775e-05    -4.684    -4.751    -0.067
   CaCO3                  5.528e-06   5.565e-06    -5.257    -5.255     0.003
   CaSO4                  1.983e-06   1.996e-06    -5.703    -5.700     0.003
   CaOH+                  8.649e-10   7.367e-10    -9.063    -9.133    -0.070
   CaHSO4+                2.704e-13   2.303e-13   -12.568   -12.638    -0.070
Cl               3.269e-03
   Cl-                    3.269e-03   2.769e-03    -2.486    -2.558    -0.072
H(0)             0.000e+00
   H2                     0.000e+00   0.000e+00   -44.365   -44.362     0.003
Mg               1.360e-04
   Mg+2                   1.178e-04   6.482e-05    -3.929    -4.188    -0.260
   MgHCO3+                1.415e-05   1.206e-05    -4.849    -4.919    -0.070
   MgCO3                  2.326e-06   2.341e-06    -5.633    -5.631     0.003
   MgSO4                  1.726e-06   1.737e-06    -5.763    -5.760     0.003
   MgOH+                  1.402e-08   1.194e-08    -7.853    -7.923    -0.070
Na               3.416e-02
   Na+                    3.386e-02   2.891e-02    -1.470    -1.539    -0.069
   NaHCO3                 2.567e-04   2.584e-04    -3.591    -3.588     0.003
   NaCO3-                 2.392e-05   2.038e-05    -4.621    -4.691    -0.070
   NaSO4-                 1.945e-05   1.657e-05    -4.711    -4.781    -0.070
   NaOH                   9.625e-09   9.689e-09    -8.017    -8.014     0.003
O(0)             4.373e-04
   O2                     2.187e-04   2.201e-04    -3.660    -3.657     0.003
S(-2)            0.000e+00
   HS-                    0.000e+00   0.000e+00  -142.770  -142.843    -0.073
   H2S                    0.000e+00   0.000e+00  -143.610  -143.607     0.003
   S-2                    0.000e+00   0.000e+00  -147.784  -148.055    -0.271
S(6)             2.372e-04
   SO4-2                  2.140e-04   1.143e-04    -3.670    -3.942    -0.272
   NaSO4-                 1.945e-05   1.657e-05    -4.711    -4.781    -0.070
   CaSO4                  1.983e-06   1.996e-06    -5.703    -5.700     0.003
   MgSO4                  1.726e-06   1.737e-06    -5.763    -5.760     0.003
   HSO4-                  2.570e-10   2.189e-10    -9.590    -9.660    -0.070
   CaHSO4+                2.704e-13   2.303e-13   -12.568   -12.638    -0.070

------------------------------Saturation indices-------------------------------

	Phase               SI   log IAP  log KT

	Anhydrite        -3.64     -8.00   -4.36  CaSO4
	Aragonite        -0.14     -8.48   -8.34  CaCO3
	Calcite           0.00     -8.48   -8.48  CaCO3
	CH4(g)         -140.75   -143.61   -2.86  CH4
	CO2(g)           -1.68     -3.15   -1.47  CO2
	Dolomite          0.00    -17.09  -17.09  CaMg(CO3)2
	Gypsum           -3.42     -8.00   -4.58  CaSO4:2H2O
	H2(g)           -41.21    -44.36   -3.15  H2
	H2O(g)           -1.51     -0.00    1.51  H2O
	H2S(g)         -142.61   -143.61   -1.00  H2S
	Halite           -5.68     -4.10    1.58  NaCl
	O2(g)            -0.76     -3.66   -2.89  O2
	Sulfur         -107.28   -102.40    4.88  S


------------------
End of simulation.
------------------

------------------------------------
Reading input data for simulation 3.
------------------------------------

	SOLUTION_RAW       20
	  -temp              25
	  -pH                7
	  -pH                xx
ERROR: Expected numeric value for pH.
	  -xx                1
ERROR: Unknown input in SOLUTION_RAW keyword.
ERROR:   -xx                1
	  -pe                4
	  -mu                1e-07
	  -ah2o              1
	  -total_h           111.01974134192
	  -total_o           55.535325076996
	  -cb                0.0012883279473439
	  -mass_water        1
	  -total_alkalinity  0
	  -totals
	    As   4.1908616387069e-07
	    C   0.0096003939798442
	    Ca   9.3009440332783e-05
	    Cl   0.0032689522220291
	    Mg   6.6514137243683e-05
	    Na   0.01444565173261
	    S   0.00023718575024482
	  -activities
	    As   -8.3776966771614
	    C(-4)   -4.0177109440686
	    C(4)   -4.0177109440686
	    Ca   -6.0314729689045
	    Cl   -4.4855914268839
	    Mg   -6.1770860377888
	    Na   -3.8402628596702
	    S(-2)   -5.6249114062687
	    S(6)   -5.6249114062687
	  -gammas
	  -Isotopes
ERROR: Calculations terminating due to input errors.
Stopping.
